{
  "$schema": "https://json-schema.org/draft/2020-12/schema",
  "$id": "https://wos-spec.org/schemas/studio-effectiveness/1.0",
  "title": "WOS Studio (Authoring) — Effectiveness",
  "description": "Single composable Effectiveness object per studio-authoring/specs/effectiveness-and-applicability.md. Carries jurisdictional + temporal + appellate scope as one object referenced by SourceVersion, PolicyObject, Mapping, WorkflowIntent, and WorkflowElement via `effectivenessRef` — never copied. Composes parent `wos-delivery.schema.json#appliesWhen` FEL semantics. Single canonical home (this schema); referenced everywhere.",
  "$comment": "Promotion status (Stage-3, 2026-05-01): MVP shape; jurisdictions[] and temporalScope are load-bearing; appellateState + supersession refs are illustrative.",
  "type": "object",
  "required": ["$wosStudioEffectiveness", "id", "workspaceId"],
  "additionalProperties": false,
  "patternProperties": { "^(\\$|x-)": {} },
  "properties": {
    "$wosStudioEffectiveness": {
      "type": "string",
      "const": "1.0",
      "description": "Document marker pinning this artifact to the Studio Effectiveness 1.0 schema.",
      "examples": ["1.0"],
      "x-lm": {
        "critical": true,
        "intent": "Document type marker for the Studio Effectiveness object"
      }
    },
    "id": {
      "type": "string",
      "description": "Stable Effectiveness identifier within the workspace. Referenced by `effectivenessRef` from PolicyObject, SourceVersion, WorkflowIntent, etc.",
      "examples": ["eff-state-tx-snap-current", "eff-fed-snap-2026"]
    },
    "workspaceId": {
      "type": "string",
      "description": "Workspace this Effectiveness belongs to."
    },
    "title": {
      "type": "string",
      "description": "Short human-readable label."
    },
    "description": {
      "type": "string",
      "description": "Human-readable description of the scope."
    },
    "jurisdictions": {
      "type": "array",
      "description": "Jurisdictions in scope. Each carries kind (federal/state/circuit/district/local/tribal/territorial/agency-specific) + code + optional displayName.",
      "items": {
        "type": "object",
        "required": ["kind", "code"],
        "properties": {
          "kind": {
            "type": "string",
            "enum": ["federal", "state", "circuit", "district", "local", "tribal", "territorial", "agency-specific"],
            "description": "Jurisdiction kind."
          },
          "code": {
            "type": "string",
            "description": "Jurisdiction code (ISO-3166 country/subdivision, FIPS, agency identifier, or other authoritative identifier).",
            "examples": ["US", "US-TX", "5th-circuit", "TX-Travis"]
          },
          "displayName": {
            "type": "string",
            "description": "Human-readable jurisdiction name."
          }
        },
        "additionalProperties": false
      }
    },
    "temporalScope": {
      "type": "object",
      "description": "Temporal scope (intervals, sunset, retroactive applicability).",
      "properties": {
        "intervals": {
          "type": "array",
          "description": "Time intervals during which this Effectiveness applies. Each carries `start` and optional `end` (open-ended if omitted).",
          "items": {
            "type": "object",
            "properties": {
              "start": { "type": "string", "format": "date" },
              "end": { "type": ["string", "null"], "format": "date" }
            }
          }
        },
        "sunsetAt": {
          "type": ["string", "null"],
          "format": "date",
          "description": "Optional explicit sunset date."
        },
        "retroactiveFrom": {
          "type": ["string", "null"],
          "format": "date",
          "description": "Optional retroactive applicability date."
        }
      },
      "additionalProperties": false
    },
    "appellateState": {
      "type": "string",
      "enum": ["final", "on-appeal", "enjoined", "provisional"],
      "description": "Appellate disposition (final = court ruling stands; on-appeal = under appellate review; enjoined = court has stayed application; provisional = adopted but not yet final)."
    },
    "enjoinedScope": {
      "type": "array",
      "description": "When appellateState = enjoined, the jurisdictions in which the injunction applies. Empty if not enjoined.",
      "items": {
        "type": "object",
        "properties": {
          "kind": { "type": "string" },
          "code": { "type": "string" }
        }
      }
    },
    "supersedingRef": {
      "type": ["string", "null"],
      "description": "When this Effectiveness has been superseded, reference to the superseding Effectiveness id."
    },
    "supersededByRef": {
      "type": ["string", "null"],
      "description": "Inverse of supersedingRef."
    },
    "provenance": {
      "type": "array",
      "description": "Authoring provenance refs.",
      "items": { "type": "string" }
    },
    "citations": {
      "type": "array",
      "description": "SourceCitation refs grounding this Effectiveness.",
      "items": { "type": "string" }
    }
  }
}
